doi,title,year,citations,pdf_url,source
10.1002/smll.202410232,Role of Mesoporosity in Hard Carbon Anodes for High‐Energy and Stable Potassium‐Ion Storage,2025,15,https://onlinelibrary.wiley.com/doi/pdfdirect/10.1002/smll.202410232,openalex
10.3390/polym14194046,Synthesis and Characterizations of Na4MnCr(PO4)3/rGO as NASICON-Type Cathode Materials for Sodium-ion Batteries,2022,15,https://www.mdpi.com/2073-4360/14/19/4046/pdf?version=1664325579,openalex
10.1149/2.1381814jes,Electrochemical Performance of Layered FeSe for Sodium Ion Batteries Using Ether-Based Solvents,2018,15,https://doi.org/10.1149/2.1381814jes,openalex
10.1039/c9ra07960b,Spontaneous precipitation pattern formation by crystallites of Mn–Fe-based Prussian blue analogues in agarose gel,2019,15,https://pubs.rsc.org/en/content/articlepdf/2019/ra/c9ra07960b,openalex
10.1021/acsaem.2c02464,Stabilizing the NASICON Solid Electrolyte in an Inert Atmosphere as a Function of Physical Properties and Sintering Conditions for Solid-State Battery Fabrication,2023,15,https://hal.science/hal-04039580/document,openalex
10.1021/acsenergylett.3c02388,Migration of Mg in Na–O–Mg Configuration for Oxygen Redox of Sodium Cathode,2023,15,https://research.utwente.nl/en/publications/3122cc5c-8b4e-4474-8733-19fea6642a49,openalex
10.1016/j.ssi.2024.116561,The use of hot-pressing to reduce grain boundary resistance in Nasicon of nominal composition Na3Zr2Si2PO12,2024,15,https://escholarship.org/content/qt6b18z4fn/qt6b18z4fn.pdf,openalex
10.3389/fenrg.2020.615677,Na0.44MnO2/Polyimide Aqueous Na-ion Batteries for Large Energy Storage Applications,2021,15,https://www.frontiersin.org/articles/10.3389/fenrg.2020.615677/pdf,openalex
10.1021/acsomega.2c06224,Microscopic Analysis of the Mechanical Stability of an SEI Layer Structure Depending on the FEC Additive Concentration in Na-Ion Batteries: Maximum Appearance in Vickers Hardness at Lower FEC Concentrations,2023,15,https://pubs.acs.org/doi/pdf/10.1021/acsomega.2c06224,openalex
10.1063/5.0151559,NASICON-based all-solid-state Na–ion batteries: A perspective on manufacturing via tape-casting process,2023,15,https://pubs.aip.org/aip/ape/article-pdf/doi/10.1063/5.0151559/18023958/020902_1_5.0151559.pdf,openalex
10.1038/s41598-024-53154-5,Chloride electrode composed of ubiquitous elements for high-energy-density all-solid-state sodium-ion batteries,2024,15,https://www.nature.com/articles/s41598-024-53154-5.pdf,openalex
10.1016/j.cej.2022.137903,Integrating a three-dimensional Cu2MoS4 electrode and solid-state polymer electrolyte for sodium-ion batteries,2022,15,https://ars.els-cdn.com/content/image/1-s2.0-S1385894722033897-ga1_lrg.jpg,openalex
10.1039/d4ta03034f,Unveiling the structural integrity of tunnel-type Na<sub>0.44</sub>MnO<sub>2</sub> cathode for sodium ion battery,2024,15,https://pubs.rsc.org/en/content/articlepdf/2024/ta/d4ta03034f,openalex
10.1002/smll.202200177,"Investigating the Role of Surface Roughness and Defects on EC Breakdown, as a Precursor to SEI Formation in Hard Carbon Sodium‐Ion Battery Anodes",2022,15,https://onlinelibrary.wiley.com/doi/pdfdirect/10.1002/smll.202200177,openalex
10.1016/j.xcrp.2020.100082,Doping Induced Hierarchical Lattice Expansion of Cobalt Diselenide/Carbon Nanosheet Hybrid for Fast and Stable Sodium Storage,2020,15,https://doi.org/10.1016/j.xcrp.2020.100082,openalex
10.1016/j.jpowsour.2020.229017,Enhanced electrochemical properties of ball-milled γ′-V2O5 as cathode material for Na-ion batteries: A structural and kinetic investigation,2020,15,https://hal.science/hal-02991477,openalex
10.3390/polym15061496,Prussian Blue Analogue-Derived Fe-Doped CoS2 Nanoparticles Confined in Bayberry-like N-Doped Carbon Spheres as Anodes for Sodium-Ion Batteries,2023,15,https://www.mdpi.com/2073-4360/15/6/1496/pdf?version=1679026963,openalex
10.1021/acsami.3c02633,Fast-Charging Capability of Thin-Film Prussian Blue Analogue Electrodes for Aqueous Sodium-Ion Batteries,2023,15,https://hdl.handle.net/10195/83630,openalex
10.3390/batteries4010008,High-Performance Na0.44MnO2 Slabs for Sodium-Ion Batteries Obtained through Urea-Based Solution Combustion Synthesis,2018,15,https://www.mdpi.com/2313-0105/4/1/8/pdf?version=1518193380,openalex
10.1002/batt.201900113,"Versatile Synthesis of Vanadium(III, IV, V) Oxides@Reduced Graphene Oxide Nanocomposites and Evaluation of their Lithium and Sodium Storage Performances",2019,15,http://hdl.handle.net/2078.1/225395,openalex
10.3390/molecules28031409,Mnx+ Substitution to Improve Na3V2(PO4)2F3-Based Electrodes for Sodium-Ion Battery Cathode,2023,15,https://www.mdpi.com/1420-3049/28/3/1409/pdf?version=1675916712,openalex
10.1002/adma.202419190,In Situ Construction of a 3D Superionic Skeleton in Sodium Anode for Solid‐State Sodium Batteries with a 15 000‐Cycle Lifespan at 3C,2025,15,https://onlinelibrary.wiley.com/doi/pdfdirect/10.1002/adma.202419190,openalex
10.1016/j.jclepro.2022.131994,Marine shrimp/tin waste as a negative electrode for rechargeable sodium-ion batteries,2022,15,https://doi.org/10.1016/j.jclepro.2022.131994,openalex
10.1016/j.jechem.2024.06.007,Surface engineering of P2-type cathode material targeting long-cycling and high-rate sodium-ion batteries,2024,15,https://doi.org/10.1016/j.jechem.2024.06.007,openalex
10.1039/c8ra03093f,Porous carbon adsorption layer enabling highly reversible redox-reaction of a high potential organic electrode material for sodium ion batteries,2018,15,https://pubs.rsc.org/en/content/articlepdf/2018/ra/c8ra03093f,openalex
10.1039/d4sc02266a,Carboxylate ester-based electrolytes for Na-ion batteries,2024,15,https://pubs.rsc.org/en/content/articlepdf/2024/sc/d4sc02266a,openalex
10.3390/nano10081588,Effect of Hematite Doping with Aliovalent Impurities on the Electrochemical Performance of α-Fe2O3@rGO-Based Anodes in Sodium-Ion Batteries,2020,15,https://www.mdpi.com/2079-4991/10/8/1588/pdf?version=1597244407,openalex
10.1016/j.apsusc.2021.152126,Lithium and sodium storage performance of tin oxyphosphate anode materials,2021,15,https://ruj.uj.edu.pl/xmlui/handle/item/289064,openalex
10.1039/d3ra00635b,N-Doped carbon nanoparticles on highly porous carbon nanofiber electrodes for sodium ion batteries,2023,15,https://pubs.rsc.org/en/content/articlepdf/2023/ra/d3ra00635b,openalex
10.1007/s40820-025-01706-3,Tunable Platform Capacity of Metal–Organic Frameworks via High-Entropy Strategy for Ultra-Fast Sodium Storage,2025,15,https://link.springer.com/content/pdf/10.1007/s40820-025-01706-3.pdf,openalex
10.1039/c8ra03514h,Large interlayer spacing vanadium oxide nanotubes as cathodes for high performance sodium ion batteries,2018,15,https://pubs.rsc.org/en/content/articlepdf/2018/ra/c8ra03514h,openalex
10.1039/d5ee00415b,Benchmarking state-of-the-art sodium-ion battery cells – modeling energy density and carbon footprint at the gigafactory-scale,2025,14,https://pubs.rsc.org/en/content/articlepdf/2025/ee/d5ee00415b,openalex
10.1016/j.cej.2024.157979,Multivalent cation substitution boosted sodium-ion storage in NASICON-type iron-phospho-sulphate cathodes,2024,14,https://doi.org/10.1016/j.cej.2024.157979,openalex
10.1021/acsmaterialsau.3c00090,Tunable Photocatalytic Activity of CoFe Prussian Blue Analogue Modified SrTiO<sub>3</sub> Core–Shell Structures for Solar-Driven Water Oxidation,2023,14,https://doi.org/10.1021/acsmaterialsau.3c00090,openalex
10.1088/1361-6528/ad1441,Scalable synthesis of N/S co-doped hard carbon microspheres as a high-performance anode material for sodium-ion batteries,2023,14,https://doi.org/10.1088/1361-6528/ad1441,openalex
10.1039/d1na00008j,"Impact of CO<sub>2</sub> activation on the structure, composition, and performance of Sb/C nanohybrid lithium/sodium-ion battery anodes",2021,14,https://doi.org/10.1039/d1na00008j,openalex
10.1002/ange.202423864,Reconfiguring Terminal Species of Bituminous Coal to Steer Hard Carbon toward High‐Capacity and Fast Sodium Storage,2025,14,https://onlinelibrary.wiley.com/doi/pdfdirect/10.1002/ange.202423864,openalex
10.1007/s40820-024-01589-w,"An Ultra-Stable, High-Energy and Wide-Temperature-Range Aqueous Alkaline Sodium-Ion Battery with the Microporous C4N/rGO Anode",2025,14,https://link.springer.com/content/pdf/10.1007/s40820-024-01589-w.pdf,openalex
10.3390/nano7090253,Electrochemical Properties of an Na4Mn9O18-Reduced Graphene Oxide Composite Synthesized via Spray Drying for an Aqueous Sodium-Ion Battery,2017,14,https://www.mdpi.com/2079-4991/7/9/253/pdf?version=1504338725,openalex
10.1039/c7ra12617d,Three-dimensional macroporous graphene monoliths with entrapped MoS<sub>2</sub>nanoflakes from single-step synthesis for high-performance sodium-ion batteries,2018,14,https://pubs.rsc.org/en/content/articlepdf/2018/ra/c7ra12617d,openalex
10.3390/en12234534,Cathode Properties of Na3MnPO4CO3 Prepared by the Mechanical Ball Milling Method for Na-Ion Batteries,2019,14,https://www.mdpi.com/1996-1073/12/23/4534/pdf?version=1574939298,openalex
10.3866/pku.whxb202303041,"Novel Alkaline Sodium-Ion Battery Capacitor Based on Active Carbon||Na0.44MnO2 towards Low Cost, High-Rate Capability and Long-Term Lifespan",2023,14,http://www.whxb.pku.edu.cn/CN/article/downloadArticleFile.do?attachType=PDF&id=37593,openalex
10.3390/batteries8080098,Binder-Free Ge-Co-P Anode Material for Lithium-Ion and Sodium-Ion Batteries,2022,14,https://www.mdpi.com/2313-0105/8/8/98/pdf?version=1660909798,openalex
10.3390/molecules28134921,Phosphate-Induced Reaction to Prepare Coal-Based P-Doped Hard Carbon with a Hierarchical Porous Structure for Improved Sodium-Ion Storage,2023,14,https://www.mdpi.com/1420-3049/28/13/4921/pdf?version=1687429087,openalex
10.1039/d1ta03101e,Hierarchical polyaromatic hydrocarbons (PAH) with superior sodium storage properties,2021,14,https://www.osti.gov/biblio/1809894,openalex
10.1063/5.0196568,<i>Operando</i> nano-mapping of sodium-diglyme co-intercalation and SEI formation in sodium ion batteries' graphene anodes,2024,14,https://pubs.aip.org/aip/apr/article-pdf/doi/10.1063/5.0196568/19970721/021422_1_5.0196568.pdf,openalex
10.7498/aps.67.20180847,Research progress of materials and devices for room-temperature Na-ion batteries,2018,14,https://doi.org/10.7498/aps.67.20180847,openalex
10.1016/j.ceja.2022.100292,Surface modification of Na0.44MnO2 via a nonaqueous solution-assisted coating for ultra-Stable and High-Rate sodium-ion batteries,2022,14,https://doi.org/10.1016/j.ceja.2022.100292,openalex
10.1039/d4sc08351b,Periodic law-guided design of highly stable O3-type layered oxide cathodes for practical sodium-ion batteries,2025,14,https://pubs.rsc.org/en/content/articlepdf/2025/sc/d4sc08351b,openalex
10.3390/en18030661,First Look at Safety and Performance Evaluation of Commercial Sodium-Ion Batteries,2025,14,https://doi.org/10.3390/en18030661,openalex
10.1002/aenm.202405894,Sustainable Recovery and Reuse of Hard Carbon From Scrap and End‐of‐Life Sodium‐Ion Batteries,2025,14,https://onlinelibrary.wiley.com/doi/pdfdirect/10.1002/aenm.202405894,openalex
10.1016/j.est.2024.114931,First full cell parameterization of a commercial layered oxide/hard carbon sodium-ion 18650 battery cell for a physico-chemical model,2024,14,https://doi.org/10.1016/j.est.2024.114931,openalex
10.26599/nr.2025.94907625,Recent advances on coal-based hard carbon anode materials for sodium-ion batteries,2025,14,https://sciopen.com/article_pdf/1927533741754290178.pdf,openalex
10.3390/polym14245541,"Centrifugally Spun PVA/PVP Based B, N, F Doped Carbon Nanofiber Electrodes for Sodium Ion Batteries",2022,14,https://www.mdpi.com/2073-4360/14/24/5541/pdf?version=1671431914,openalex
10.3866/pku.whxb201903013,Insight into Effects of Fluoroethylene Carbonate Additive on the Cathode in Sodium Ion Batteries,2019,14,http://www.whxb.pku.edu.cn/CN/article/downloadArticleFile.do?attachType=PDF&id=34976,openalex
10.1016/j.micromeso.2022.111853,Ordered sodium zeolite-templated carbon with high first discharge capacity for sodium battery application,2022,14,https://hal.science/hal-04295959,openalex
10.34133/2021/9795825,Sodium-Ion Battery Anode Construction with SnP <i> <sub>x</sub> </i> Crystal Domain in Amorphous Phosphorus Matrix,2021,14,https://downloads.spj.sciencemag.org/energymatadv/2021/9795825.pdf,openalex
10.1016/j.nanoen.2024.109925,Heteroatom anchoring to enhance electrochemical reversibility for high-voltage P2-type oxide cathodes of sodium-ion batteries,2024,14,https://doi.org/10.1016/j.nanoen.2024.109925,openalex
10.1016/j.jmat.2021.03.010,Design of solid-state sodium-ion batteries with high mass-loading cathode by porous-dense bilayer electrolyte,2021,14,https://doi.org/10.1016/j.jmat.2021.03.010,openalex
10.1016/j.electacta.2019.134926,Effect of Fe3+ for Ru4+ substitution in disordered Na1.33Ru0.67O2 cathode for sodium-ion batteries: Structural and electrochemical characterizations,2019,14,https://ars.els-cdn.com/content/image/1-s2.0-S0013468619317979-fx1_lrg.jpg,openalex
10.3390/ma15082787,Heterostructured Bi2O3@rGO Anode for Electrochemical Sodium Storage,2022,14,https://www.mdpi.com/1996-1944/15/8/2787/pdf?version=1649651132,openalex
10.1016/j.cej.2024.151914,Enhanced stability of sodium anodes by amino-functioned macroporous two-dimensional nanodiamond coated polypropylene separators,2024,14,https://doi.org/10.1016/j.cej.2024.151914,openalex
10.1016/j.elecom.2022.107344,NiP nanoparticles encapsulated in lamellar carbon as high-performance anode materials for sodium-ion batteries,2022,14,https://doi.org/10.1016/j.elecom.2022.107344,openalex
10.1016/j.pnsc.2020.01.016,Hollow bismuth ferrite combined graphene as advanced anode material for sodium-ion batteries,2020,14,https://doi.org/10.1016/j.pnsc.2020.01.016,openalex
10.3390/nano12203569,Enhanced Electrochemical Performances of Mn3O4/Heteroatom-Doped Reduced Graphene Oxide Aerogels as an Anode for Sodium-Ion Batteries,2022,14,https://www.mdpi.com/2079-4991/12/20/3569/pdf?version=1665576992,openalex
10.20517/microstructures.2024.01,Multiphase manganese-based layered oxide for sodium-ion batteries: structural change and phase transition,2024,14,https://f.oaes.cc/xmlpdf/0f981f1f-5bc4-4e29-900e-3350bae5ad22/microstructures4001.pdf,openalex
10.1016/j.mtener.2022.101184,MXene conversion to V2S3 heterostructure in CS2 ambient: A novel approach for sodium-ion battery anodes,2022,14,http://hdl.handle.net/10754/681135,openalex
10.1038/s41563-025-02287-7,Solvent co-intercalation in layered cathode active materials for sodium-ion batteries,2025,14,https://www.nature.com/articles/s41563-025-02287-7.pdf,openalex
10.3390/electrochem2020023,Understanding the Effect of Zn Doping on Stability of Cobalt-Free P2-Na0.60Fe0.5Mn0.5O2 Cathode for Sodium Ion Batteries,2021,14,https://www.mdpi.com/2673-3293/2/2/23/pdf?version=1622625257,openalex
10.3390/met8060461,Synthesis of Core-Shell Carbon Encapsulated Fe2O3 Composite through a Facile Hydrothermal Approach and Their Application as Anode Materials for Sodium-Ion Batteries,2018,14,https://www.mdpi.com/2075-4701/8/6/461/pdf?version=1529292185,openalex
10.1007/s40820-024-01474-6,Ultra-Stable Sodium-Ion Battery Enabled by All-Solid-State Ferroelectric-Engineered Composite Electrolytes,2024,14,https://link.springer.com/content/pdf/10.1007/s40820-024-01474-6.pdf,openalex
10.1016/j.cartre.2024.100387,State change of Na clusters in hard carbon electrodes and increased capacity for Na-ion batteries achieved by heteroatom doping,2024,14,https://doi.org/10.1016/j.cartre.2024.100387,openalex
10.1016/j.electacta.2024.144197,Exploring the reactivity of Na3V2(PO4)3/C and hard carbon electrodes in sodium-ion batteries at various charge states,2024,14,https://doi.org/10.1016/j.electacta.2024.144197,openalex
10.1002/adma.202400229,Unlocking the Sodium Storage Potential in Fluorophosphate Cathodes: Electrostatic Interaction Lowering Versus Structural Disordering,2025,14,https://onlinelibrary.wiley.com/doi/pdfdirect/10.1002/adma.202400229,openalex
10.1002/ente.202300338,Process and Drying Behavior Toward Higher Drying Rates of Hard Carbon Anodes for Sodium‐Ion Batteries with Different Particle Sizes: An Experimental Study in Comparison to Graphite for Lithium‐Ion‐Batteries,2023,14,https://onlinelibrary.wiley.com/doi/pdfdirect/10.1002/ente.202300338,openalex
10.3390/ma12071074,Tin-Decorated Reduced Graphene Oxide and NaLi0.2Ni0.25Mn0.75Oδ as Electrode Materials for Sodium-Ion Batteries,2019,14,https://www.mdpi.com/1996-1944/12/7/1074/pdf?version=1554803706,openalex
10.1021/acsomega.7b00540,Economic and High Performance Phosphorus–Carbon Composite for Lithium and Sodium Storage,2017,14,https://doi.org/10.1021/acsomega.7b00540,openalex
10.1002/batt.202300402,Spray‐coated Hard Carbon Composite Anodes for Sodium‐Ion Insertion,2023,14,https://onlinelibrary.wiley.com/doi/pdfdirect/10.1002/batt.202300402,openalex
10.1016/j.carbon.2024.119398,Structural and chemical analysis of hard carbon negative electrode for Na-ion battery with X-ray Raman scattering and solid-state NMR spectroscopy,2024,14,https://ars.els-cdn.com/content/image/1-s2.0-S0008622324006171-ga1_lrg.jpg,openalex
10.1039/d4ta07393b,High performing and sustainable hard carbons for Na-ion batteries through acid-catalysed hydrothermal carbonisation of vine shoots,2024,14,https://pubs.rsc.org/en/content/articlepdf/2025/ta/d4ta07393b,openalex
10.1039/c9na00521h,Engineering doping-vacancy double defects and insights into the conversion mechanisms of an Mn–O–F ultrafine nanowire anode for enhanced Li/Na-ion storage and hybrid capacitors,2019,14,https://pubs.rsc.org/en/content/articlepdf/2019/na/c9na00521h,openalex
10.1039/d1ta07897f,Mechanochemical synthesis of sodium carboxylates as anode materials in sodium ion batteries,2021,14,https://pubs.rsc.org/en/content/articlepdf/2021/ta/d1ta07897f,openalex
10.1039/c6cp03379b,Study of the interface between Na-rich and Li-rich phases in a Na-inserted spinel Li<sub>4</sub>Ti<sub>5</sub>O<sub>12</sub> crystal for an electrode of a sodium-ion battery,2016,14,https://pubs.rsc.org/en/content/articlepdf/2016/cp/c6cp03379b,openalex
10.1039/d4sc02587c,Synergistic interface and structural engineering for high initial coulombic efficiency and stable sodium storage in metal sulfides,2024,14,https://pubs.rsc.org/en/content/articlepdf/2024/sc/d4sc02587c,openalex
10.1039/d0ra08332a,Aliovalent-doped sodium chromium oxide (Na<sub>0.9</sub>Cr<sub>0.9</sub>Sn<sub>0.1</sub>O<sub>2</sub> and Na<sub>0.8</sub>Cr<sub>0.9</sub>Sb<sub>0.1</sub>O<sub>2</sub>) for sodium-ion battery cathodes with high-voltage characteristics,2020,14,https://pubs.rsc.org/en/content/articlepdf/2020/ra/d0ra08332a,openalex
10.1002/smll.202410456,Synergistically Boosted Na<sup>+</sup> Migration and Deep Desodiation Stability of NASICON Cathode via High Entropy Regulation,2025,14,https://onlinelibrary.wiley.com/doi/pdfdirect/10.1002/smll.202410456,openalex
10.1088/2053-1591/ab6f37,Electrospun Na<sub>3</sub>V<sub>2</sub>(PO<sub>4</sub>)<sub>3</sub>/C nanofibers as self-standing cathode material for high performance sodium ion batteries,2020,14,https://doi.org/10.1088/2053-1591/ab6f37,openalex
10.1002/celc.202300134,"Defective Prussian Blue Analogue with Cobalt for Fabrication of An Electrochemical Sensor for Detecting Ascorbic Acid, Dopamine and Uric Acid",2023,14,https://onlinelibrary.wiley.com/doi/pdfdirect/10.1002/celc.202300134,openalex
10.1016/j.jcis.2024.06.196,Demineralization activating highly-disordered lignite-derived hard carbon for fast sodium storage,2024,14,https://doi.org/10.1016/j.jcis.2024.06.196,openalex
10.1016/j.nxsust.2024.100044,High-entropy materials for sodium-ion batteries,2024,14,https://doi.org/10.1016/j.nxsust.2024.100044,openalex
10.1002/smll.202404957,Efficient Sodium Storage in Cu <sub>1.96</sub> S@NC Anode Achieved by Robust S─C Bonds and Current Collector Self‐Induced Forming Cu <sub>2</sub> S Quantum Dots,2024,14,https://onlinelibrary.wiley.com/doi/pdfdirect/10.1002/smll.202404957,openalex
10.1016/j.nanoen.2024.109676,Dual-ion regulation of coordination chemistry for high-voltage stabilized P2-type cathode,2024,14,https://doi.org/10.1016/j.nanoen.2024.109676,openalex
10.1016/j.ccr.2025.216912,Synergistic role of transition metals and polyanionic frameworks in phosphate-based cathode materials for sodium-ion batteries,2025,13,https://arxiv.org/pdf/2504.19299,openalex
10.3389/fenrg.2016.00013,Improving NASICON Sinterability through Crystallization under High-Frequency Electrical Fields,2016,13,https://www.frontiersin.org/articles/10.3389/fenrg.2016.00013/pdf,openalex
10.1016/j.ensm.2024.103272,Empirical correlation of quantified hard carbon structural parameters with electrochemical properties for sodium-ion batteries using a combined WAXS and SANS analysis,2024,13,https://doi.org/10.1016/j.ensm.2024.103272,openalex
10.3390/nano14171410,Effect of Sulfur Modification on Structural and Electrochemical Performance of Pitch-Based Carbon Materials for Lithium/Sodium Ion Batteries,2024,13,https://www.mdpi.com/2079-4991/14/17/1410/pdf?version=1724911661,openalex
10.3390/nano9050754,Biphenyl-Bridged Organosilica as a Precursor for Mesoporous Silicon Oxycarbide and Its Application in Lithium and Sodium Ion Batteries,2019,13,https://www.mdpi.com/2079-4991/9/5/754/pdf?version=1558018658,openalex
10.1007/s43979-024-00081-z,Research progress of electrolyte additives for subzero-temperature aqueous sodium-ion batteries,2024,13,https://link.springer.com/content/pdf/10.1007/s43979-024-00081-z.pdf,openalex
10.1039/c9ra08558k,Double-layer carbon protected CoS<sub>2</sub> nanoparticles as an advanced anode for sodium-ion batteries,2019,13,https://pubs.rsc.org/en/content/articlepdf/2019/ra/c9ra08558k,openalex
10.1002/anie.202420504,Cascade Selenization Regulated the Electronic Structure and Interface Effect of Transition Metal Sulfides for Enhanced Sodium Storage,2024,13,https://onlinelibrary.wiley.com/doi/pdfdirect/10.1002/anie.202420504,openalex
10.1515/ntrev-2020-0091,Combining Zn <sub>0.76</sub> Co <sub>0.24</sub> S with S-doped graphene as high-performance anode materials for lithium- and sodium-ion batteries,2020,13,https://www.degruyter.com/downloadpdf/journals/ntrev/9/1/article-p1227.pdf,openalex
10.1039/d0ma00029a,A square channel vanadium phosphite framework as a high voltage cathode for Li- and Na-ion batteries,2020,13,https://pubs.rsc.org/en/content/articlepdf/2020/ma/d0ma00029a,openalex
10.1021/acsaem.0c02025,Monitoring the Sodiation Mechanism of Anatase TiO<sub>2</sub> Nanoparticle-Based Electrodes for Sodium-Ion Batteries by <i>Operando</i> XANES Measurements,2020,13,http://hdl.handle.net/11573/1555160,openalex
10.1039/c7ra01629h,Na intercalation in Fe-MIL-100 for aqueous Na-ion batteries,2017,13,https://pubs.rsc.org/en/content/articlepdf/2017/ra/c7ra01629h,openalex
10.1016/j.est.2024.110844,The potential of plasma-derived hard carbon for sodium-ion batteries,2024,13,https://doi.org/10.1016/j.est.2024.110844,openalex
10.26599/jac.2023.9220738,Improving ionic conductivity of von-Alpen-type NASICON ceramic electrolytes via magnesium doping,2023,13,https://www.sciopen.com/article_pdf/1630101400895303681.pdf,openalex
10.3390/membranes12111156,A Novel Membrane-like 2D A’-MoS2 as Anode for Lithium- and Sodium-Ion Batteries,2022,13,https://www.mdpi.com/2077-0375/12/11/1156/pdf?version=1669084393,openalex
10.3390/en16248004,Elevating the Practical Application of Sodium-Ion Batteries through Advanced Characterization Studies on Cathodes,2023,13,https://www.mdpi.com/1996-1073/16/24/8004/pdf?version=1702279653,openalex
10.1002/advs.202510328,Regulating Pores and Carbonyl Groups of Biomass‐Derived Hard Carbon for Enhanced Sodium Storage,2025,13,https://onlinelibrary.wiley.com/doi/pdfdirect/10.1002/advs.202510328,openalex
10.1039/c9na00815b,Simultaneously formed and embedding-type ternary MoSe<sub>2</sub>/MoO<sub>2</sub>/nitrogen-doped carbon for fast and stable Na-ion storage,2020,13,https://pubs.rsc.org/en/content/articlepdf/2020/na/c9na00815b,openalex
10.1002/smll.202404660,Achieving a Rapid Na <sup>+</sup> Migration and Highly Reversible Phase Transition of NASICON for Sodium‐Ion Batteries with Suppressed Voltage Hysteresis and Ultralong Lifespan,2024,13,https://hal.science/hal-05350438/document,openalex
10.1021/acs.chemmater.4c02326,Impact of Sodium on the Water Dynamics in Prussian Blue Analogues,2024,13,https://doi.org/10.1021/acs.chemmater.4c02326,openalex
10.3390/ma14174997,Towards the High Phase Purity of Nanostructured Alluaudite-Type Glass-Ceramics Cathode Materials for Sodium Ion Batteries,2021,13,https://www.mdpi.com/1996-1944/14/17/4997/pdf?version=1630575583,openalex
10.1016/j.elecom.2019.01.024,Electroactive decomposition products cause erroneous intercalation signals in sodium-ion batteries,2019,13,https://doi.org/10.1016/j.elecom.2019.01.024,openalex
10.1039/d3ra08714j,Fe-modified NASICON-type Na <sub>3</sub> V <sub>2</sub> (PO <sub>4</sub> ) <sub>3</sub> as a cathode material for sodium ion batteries,2024,13,https://pubs.rsc.org/en/content/articlepdf/2024/ra/d3ra08714j,openalex
10.1002/aesr.202200081,Structural and Electrochemical Sodium (De)intercalation Properties of Carbon‐Coated NASICON‐Na<sub>3+<i>y</i></sub>V<sub>2−<i>y</i></sub>Mn<sub><i>y</i></sub>(PO<sub>4</sub>)<sub>3</sub> Cathodes for Na‐Ion Batteries,2022,13,https://onlinelibrary.wiley.com/doi/pdfdirect/10.1002/aesr.202200081,openalex
10.3390/ma16155386,Electrochemical Response of 3D-Printed Free-Standing Reduced Graphene Oxide Electrode for Sodium Ion Batteries Using a Three-Electrode Glass Cell,2023,13,https://www.mdpi.com/1996-1944/16/15/5386/pdf?version=1690858238,openalex
10.1073/pnas.2311075121,Unveil the origin of voltage oscillation for sodium-ion batteries operating at −40 °C,2024,13,https://doi.org/10.1073/pnas.2311075121,openalex
