doi,title,year,citations,pdf_url,source
10.15541/jim20210486,Na<sub>3</sub>Zr<sub>2</sub>Si<sub>2</sub>PO<sub>12</sub> Ceramic Electrolytes for Na-ion Battery: Preparation Using Spray-drying Method and Its Property,2021,41,http://www.jim.org.cn/EN/article/downloadArticleFile.do?attachType=PDF&id=14595,openalex
10.1016/j.electacta.2017.03.047,"Gallium oxide nanorods as novel, safe and durable anode material for Li- and Na-ion batteries",2017,41,https://www.sciencedirect.com/science/article/pii/S0013468617305133,openalex
10.1016/j.ssi.2019.115187,YS2 monolayer as a high-efficient anode material for rechargeable Li-ion and Na-ion batteries,2019,41,http://ir.lzu.edu.cn/handle/262010/416851,openalex
10.1016/j.ensm.2024.103760,"Research on low-temperature sodium-ion batteries: Challenges, strategies and prospect",2024,40,https://doi.org/10.1016/j.ensm.2024.103760,openalex
10.1007/s40820-021-00686-4,Electrolyte/Structure-Dependent Cocktail Mediation Enabling High-Rate/Low-Plateau Metal Sulfide Anodes for Sodium Storage,2021,40,https://link.springer.com/content/pdf/10.1007/s40820-021-00686-4.pdf,openalex
10.1038/s41467-025-57964-7,Smart gel polymer electrolytes enlightening high safety and long life sodium ion batteries,2025,40,https://www.nature.com/articles/s41467-025-57964-7.pdf,openalex
10.1002/adfm.202401188,Mesoporous N‐Doped Carbon Nanospheres as Anode Material for Sodium Ion Batteries with High Rate Capability and Superior Power Densities,2024,40,https://onlinelibrary.wiley.com/doi/pdfdirect/10.1002/adfm.202401188,openalex
10.34133/research.0209,Fast-Charging Sodium-Ion Batteries Enabled by Molecular-Level Designed Nitrogen and Phosphorus Codoped Mesoporous Soft Carbon,2023,40,https://doi.org/10.34133/research.0209,openalex
10.1039/c7ta08410b,Surface transformation by a “cocktail” solvent enables stable cathode materials for sodium ion batteries,2018,40,https://www.osti.gov/biblio/1425931,openalex
10.1039/c5cp07474f,A comparative computational study of lithium and sodium insertion into van der Waals and covalent tetracyanoethylene (TCNE)-based crystals as promising materials for organic lithium and sodium ion batteries,2016,40,https://pubs.rsc.org/en/content/articlepdf/2016/cp/c5cp07474f,openalex
10.20517/energymater.2023.61,Fluorine chemistry in lithium-ion and sodium-ion batteries,2023,40,https://f.oaecdn.com/xmlpdf/cd49c038-9092-4d73-81a6-fad7c175a9c8/em3061.pdf,openalex
10.1039/c9qm00674e,The application of hollow micro-/nanostructured cathodes for sodium-ion batteries,2019,40,https://pubs.rsc.org/en/content/articlepdf/2020/qm/c9qm00674e,openalex
10.1002/adfm.202312905,Enabling Electron Delocalization by Conductor Heterostructure for Highly Reversible Sodium Storage,2023,40,https://onlinelibrary.wiley.com/doi/pdfdirect/10.1002/adfm.202312905,openalex
10.1002/aenm.202302729,Deposition of Sodium Metal at the Copper‐NaSICON Interface for Reservoir‐Free Solid‐State Sodium Batteries,2023,40,https://onlinelibrary.wiley.com/doi/pdfdirect/10.1002/aenm.202302729,openalex
10.1016/j.electacta.2021.138156,Evaluation of electrochemical performance and redox activity of Fe in Ti doped layered P2-Na0.67Mn0.5Fe0.5O2 cathode for sodium ion batteries,2021,40,https://www.sciencedirect.com/science/article/am/pii/S0013468621004461?via%3Dihub,openalex
10.1016/j.electacta.2021.139764,Physics-based modeling of sodium-ion batteries part II. Model and validation,2021,40,https://doi.org/10.1016/j.electacta.2021.139764,openalex
10.1016/j.jcis.2022.07.033,Mechanism of gelation in high nickel content cathode slurries for sodium-ion batteries,2022,39,https://ars.els-cdn.com/content/image/1-s2.0-S0021979722012036-ga1_lrg.jpg,openalex
10.1016/j.xcrp.2021.100551,Structural engineering of electrode materials to boost high-performance sodium-ion batteries,2021,39,https://doi.org/10.1016/j.xcrp.2021.100551,openalex
10.1007/s40843-017-9141-7,Nanotube-like hard carbon as high-performance anode material for sodium ion hybrid capacitors,2017,39,https://link.springer.com/content/pdf/10.1007/s40843-017-9141-7.pdf,openalex
10.1007/s40843-019-1229-0,SnSe2 nanocrystals coupled with hierarchical porous carbon microspheres for long-life sodium ion battery anode,2019,39,https://link.springer.com/content/pdf/10.1007/s40843-019-1229-0.pdf,openalex
10.1016/j.jechem.2017.02.008,Metal–organic framework derived hierarchical porous TiO 2 nanopills as a super stable anode for Na-ion batteries,2017,39,https://ars.els-cdn.com/content/image/1-s2.0-S2095495616303801-fx1_lrg.jpg,openalex
10.1002/aenm.202204324,Ultrahigh‐Rate and Ultralong‐Duration Sodium Storage Enabled by Sodiation‐Driven Reconfiguration,2023,39,https://onlinelibrary.wiley.com/doi/pdfdirect/10.1002/aenm.202204324,openalex
10.1021/acsaem.1c01832,Prussian Blue Analogue—Sodium–Vanadium Hexacyanoferrate as a Cathode Material for Na-Ion Batteries,2021,39,http://infoscience.epfl.ch/record/289872,openalex
10.1002/adfm.202403841,On the Practicability of the Solid‐State Electrochemical Pre‐Sodiation Technique on Hard Carbon Anodes for Sodium‐Ion Batteries,2024,39,https://onlinelibrary.wiley.com/doi/pdfdirect/10.1002/adfm.202403841,openalex
10.1039/c8ra04421j,SnS/C nanocomposites for high-performance sodium ion battery anodes,2018,39,https://pubs.rsc.org/en/content/articlepdf/2018/ra/c8ra04421j,openalex
10.1039/d0nr05143h,Assembling Si<sub>2</sub>BN nanoribbons into a 3D porous structure as a universal anode material for both Li- and Na-ion batteries with high performance,2020,39,https://www.osti.gov/biblio/1664461,openalex
10.1016/j.elecom.2017.03.002,A ZnGeP 2 /C anode for lithium-ion and sodium-ion batteries,2017,39,https://doaj.org/article/8b5c0a16b4884732bf64541edc73fa60,openalex
10.1038/s41598-018-21354-5,Diffusion mechanism in the sodium-ion battery material sodium cobaltate,2018,39,https://www.nature.com/articles/s41598-018-21354-5.pdf,openalex
10.1002/admi.202100596,In Situ (Operando) Electrochemical Dilatometry as a Method to Distinguish Charge Storage Mechanisms and Metal Plating Processes for Sodium and Lithium Ions in Hard Carbon Battery Electrodes,2021,39,https://onlinelibrary.wiley.com/doi/pdfdirect/10.1002/admi.202100596,openalex
10.1021/acsami.7b13472,"On the P2-Na<i><sub>x</sub></i>Co<sub>1–<i>y</i></sub>(Mn<sub>2/3</sub>Ni<sub>1/3</sub>)<i>y</i>O<sub>2</sub> Cathode Materials for Sodium-Ion Batteries: Synthesis, Electrochemical Performance, and Redox Processes Occurring during the Electrochemical Cycling",2017,39,https://www.osti.gov/biblio/1461415,openalex
10.1149/2.0511701jes,Effect of Calcination Temperature on a P-type Na<sub>0.6</sub>Mn<sub>0.65</sub>Ni<sub>0.25</sub>Co<sub>0.10</sub>O<sub>2</sub>Cathode Material for Sodium-Ion Batteries,2016,39,http://jes.ecsdl.org/content/164/1/A6308.full.pdf,openalex
10.1016/j.cej.2019.03.251,1.3 V superwide potential window sponsored by Na-Mn-O plates as cathodes towards aqueous rechargeable sodium-ion batteries,2019,39,https://www.osti.gov/biblio/1525401,openalex
10.3390/molecules28083595,Modulating the Graphitic Domains and Pore Structure of Corncob-Derived Hard Carbons by Pyrolysis to Improve Sodium Storage,2023,39,https://www.mdpi.com/1420-3049/28/8/3595/pdf?version=1681982375,openalex
10.1002/nano.202000030,Manganese‐based layered oxide cathodes for sodium ion batteries,2020,38,https://onlinelibrary.wiley.com/doi/pdfdirect/10.1002/nano.202000030,openalex
10.1038/s41467-025-58113-w,Fluorinated amorphous halides with improved ionic conduction and stability for all-solid-state sodium-ion batteries,2025,38,https://www.nature.com/articles/s41467-025-58113-w.pdf,openalex
10.1149/1945-7111/ace55a,Impact of Calcium on Air Stability of Na[Ni<sub>1/3</sub>Fe<sub>1/3</sub>Mn<sub>1/3</sub>]O<sub>2</sub> Positive Electrode Material for Sodium-ion Batteries,2023,38,https://iopscience.iop.org/article/10.1149/1945-7111/ace55a/pdf,openalex
10.1002/adfm.202404591,Multiscale Scrutinizing Ion Storage Kinetics in Hollow Ni‐Mn Prussian Blue Analogues for Enhanced Capacitive Deionization,2024,38,https://onlinelibrary.wiley.com/doi/pdfdirect/10.1002/adfm.202404591,openalex
10.1021/acs.energyfuels.3c01040,Waste Hemp Hurd as a Sustainable Precursor for Affordable and High-Rate Hard Carbon-Based Anodes in Sodium-Ion Batteries,2023,38,https://pubs.acs.org/doi/pdf/10.1021/acs.energyfuels.3c01040,openalex
10.1039/c5cc04022a,FeV<sub>2</sub>S<sub>4</sub>as a high capacity electrode material for sodium-ion batteries,2015,38,https://pubs.rsc.org/en/content/articlepdf/2015/cc/c5cc04022a,openalex
10.1039/c5ta03780h,"Structural evolution of mixed valent (V<sup>3+</sup>/V<sup>4+</sup>) and V<sup>4+</sup> sodium vanadium fluorophosphates as cathodes in sodium-ion batteries: comparisons, overcharging and mid-term cycling",2015,38,https://pubs.rsc.org/en/content/articlepdf/2015/ta/c5ta03780h,openalex
10.1002/adfm.202410992,Multivalent Cation Incorporated into Manganese‐Iron Based NASICON Cathodes for High Voltage Sodium‐Ion Batteries,2024,38,https://onlinelibrary.wiley.com/doi/pdfdirect/10.1002/adfm.202410992,openalex
10.1021/acsomega.8b01407,Synergistic Role of Electrolyte and Binder for Enhanced Electrochemical Storage for Sodium-Ion Battery,2018,38,https://doi.org/10.1021/acsomega.8b01407,openalex
10.1016/j.electacta.2019.134723,Amorphous and crystalline TiO2 nanoparticle negative electrodes for sodium-ion batteries,2019,38,https://www.osti.gov/biblio/1574300,openalex
10.1039/d0na00897d,Fe<sub>7</sub>Se<sub>8</sub> encapsulated in N-doped carbon nanofibers as a stable anode material for sodium ion batteries,2020,38,https://pubs.rsc.org/en/content/articlepdf/2021/na/d0na00897d,openalex
10.1039/c9ta02166c,Theoretical tuning of Ruddlesden–Popper type anti-perovskite phases as superb ion conductors and cathodes for solid sodium ion batteries,2019,38,https://pubs.rsc.org/en/content/articlepdf/2019/ta/c9ta02166c,openalex
10.1002/bte2.20220042,Study on sodium storage properties of manganese‐doped sodium vanadium phosphate cathode materials,2023,37,https://onlinelibrary.wiley.com/doi/pdfdirect/10.1002/bte2.20220042,openalex
10.1002/cssc.202301053,Use of Hydrothermal Carbonization to Improve the Performance of Biowaste‐Derived Hard Carbons in Sodium Ion‐Batteries,2023,37,https://onlinelibrary.wiley.com/doi/pdfdirect/10.1002/cssc.202301053,openalex
10.1039/c7ra01047h,A high rate and stable electrode consisting of a Na<sub>3</sub>V<sub>2</sub>O<sub>2X</sub>(PO<sub>4</sub>)<sub>2</sub>F<sub>3−2X</sub>–rGO composite with a cellulose binder for sodium-ion batteries,2017,37,https://pubs.rsc.org/en/content/articlepdf/2017/ra/c7ra01047h,openalex
10.1016/j.matre.2024.100268,Synthesis strategies of hard carbon anodes for sodium-ion batteries,2024,37,https://ars.els-cdn.com/content/image/1-s2.0-S2666935824000326-ga1_lrg.jpg,openalex
10.1021/acsami.1c02135,Stable Na Electrodeposition Enabled by Agarose-Based Water-Soluble Sodium Ion Battery Separators,2021,37,https://doi.org/10.1021/acsami.1c02135,openalex
10.1016/j.jcis.2018.11.093,Construction of carbon-coated nickel phosphide nanoparticle assembled submicrospheres with enhanced electrochemical properties for lithium/sodium-ion batteries,2018,37,https://www.osti.gov/biblio/1635953,openalex
10.20517/energymater.2022.11,Electroactive organics as promising anode materials for rechargeable lithium ion and sodium ion batteries,2022,37,https://energymaterj.com/article/download/4835,openalex
10.20517/energymater.2024.06,Recent advances in alloying anode materials for sodium-ion batteries: material design and prospects,2024,37,https://f.oaes.cc/xmlpdf/775269e1-7ef2-45a7-93ea-bb1411763c15/em4006.pdf,openalex
10.1016/j.nanoen.2024.109971,Composite scaffold of electrospun nano-porous cellulose acetate membrane casted with chitosan for flexible solid-state sodium-ion batteries,2024,37,https://doi.org/10.1016/j.nanoen.2024.109971,openalex
10.1016/j.ceja.2020.100053,Hierarchical SnS2/carbon nanotube@reduced graphene oxide composite as an anode for ultra-stable sodium-ion batteries,2020,37,https://www.sciencedirect.com/science/article/pii/S2666821120300533?via%3Dihub,openalex
10.1016/j.electacta.2018.03.084,Graphitic carbon foams as anodes for sodium-ion batteries in glyme-based electrolytes,2018,37,http://hdl.handle.net/10261/224730,openalex
10.1016/j.carbon.2020.08.031,Nitrogen-doped graphene-wrapped Cu2S as a superior anode in sodium-ion batteries,2020,37,https://www.osti.gov/biblio/1774278,openalex
10.1038/s41598-020-59512-3,Colloidal Antimony Sulfide Nanoparticles as a High-Performance Anode Material for Li-ion and Na-ion Batteries,2020,37,https://www.nature.com/articles/s41598-020-59512-3.pdf,openalex
10.1039/c7ra07901j,Perchlorate ion doped polypyrrole coated ZnS sphere composites as a sodium-ion battery anode with superior rate capability enhanced by pseudocapacitance,2017,37,https://pubs.rsc.org/en/content/articlepdf/2017/ra/c7ra07901j,openalex
10.1016/j.electacta.2015.11.078,Expanded graphitic materials prepared from micro- and nanometric precursors as anodes for sodium-ion batteries,2015,37,http://hdl.handle.net/10261/131397,openalex
10.1002/open.201800120,Synthesis of Hollow Co–Fe Prussian Blue Analogue Cubes by using Silica Spheres as a Sacrificial Template,2018,36,https://doi.org/10.1002/open.201800120,openalex
10.1016/s1003-6326(22)65792-3,Enhancing storage performance of P2-type Na2/3Fe1/2Mn1/2O2 cathode materials by Al2O3 coating,2022,36,https://doi.org/10.1016/s1003-6326(22)65792-3,openalex
10.1002/eem2.12169,Atomic Layer Coated Al<sub>2</sub>O<sub>3</sub> on Nitrogen Doped Vertical Graphene Nanosheets for High Performance Sodium Ion Batteries,2021,36,https://onlinelibrary.wiley.com/doi/pdfdirect/10.1002/eem2.12169,openalex
10.1557/mrc.2017.25,Nanostructured layered vanadium oxide as cathode for high-performance sodium-ion batteries: a perspective,2017,36,https://www.cambridge.org/core/services/aop-cambridge-core/content/view/63FB43103B96FC044C58DE1DD0BADC6D/S2159685917000258a.pdf/div-class-title-nanostructured-layered-vanadium-oxide-as-cathode-for-high-performance-sodium-ion-batteries-a-perspective-div.pdf,openalex
10.1039/c9ra04339j,Synthesis and electrochemical performance of NaV<sub>3</sub>O<sub>8</sub> nanobelts for Li/Na-ion batteries and aqueous zinc-ion batteries,2019,36,https://pubs.rsc.org/en/content/articlepdf/2019/ra/c9ra04339j,openalex
10.1002/adfm.202300914,Strain Retarding in Multilayered Hierarchical Sn‐Doped Sb Nanoarray for Durable Sodium Storage,2023,36,https://onlinelibrary.wiley.com/doi/pdfdirect/10.1002/adfm.202300914,openalex
10.1038/s41598-017-00346-x,"Na-rich layered Na2Ti1−xCrxO3−x/2 (x = 0, 0.06): Na-ion battery cathode materials with high capacity and long cycle life",2017,36,https://doi.org/10.1038/s41598-017-00346-x,openalex
10.1002/adfm.202412730,High Entropy Helps Na<sub>4</sub>Fe<sub>3</sub>(PO<sub>4</sub>)<sub>2</sub>P<sub>2</sub>O<sub>7</sub> Improve Its Sodium Storage Performance,2024,36,https://onlinelibrary.wiley.com/doi/pdfdirect/10.1002/adfm.202412730,openalex
10.1039/c7ra09349g,Novel iodine-doped reduced graphene oxide anode for sodium ion batteries,2017,36,https://pubs.rsc.org/en/content/articlepdf/2017/ra/c7ra09349g,openalex
10.1016/j.elecom.2018.11.019,Well-defined Na2Zn3[Fe(CN)6]2 nanocrystals as a low-cost and cycle-stable cathode material for Na-ion batteries,2018,36,https://doi.org/10.1016/j.elecom.2018.11.019,openalex
10.1002/cnl2.26,3D hierarchical architectures of CoSe<sub>2</sub> nanoparticles embedded in rice‐derived hard carbon for advanced sodium storage,2022,36,https://doi.org/10.1002/cnl2.26,openalex
10.1021/acsami.2c07383,Halogenated Carboxylates as Organic Anodes for Stable and Sustainable Sodium-Ion Batteries,2022,36,https://www.osti.gov/servlets/purl/1968744,openalex
10.1039/d0ta06024k,An epoxy-reinforced ceramic sheet as a durable solid electrolyte for solid state Na-ion batteries,2020,36,https://www.osti.gov/servlets/purl/1686090,openalex
10.1007/s10008-019-04448-6,Electrochemical investigations of high-voltage Na4Ni3(PO4)2P2O7 cathode for sodium-ion batteries,2019,36,https://www.osti.gov/biblio/1608198,openalex
10.1021/acs.chemmater.3c01196,Structural Evolution of Air-Exposed Layered Oxide Cathodes for Sodium-Ion Batteries: An Example of Ni-doped Na<sub><i>x</i></sub>MnO<sub>2</sub>,2023,36,https://doi.org/10.1021/acs.chemmater.3c01196,openalex
10.1016/j.ensm.2019.07.022,Sodium storage property and mechanism of NaCr1/4Fe1/4Ni1/4Ti1/4O2 cathode at various cut-off voltages,2019,36,https://www.sciencedirect.com/science/article/am/pii/S2405829719308827,openalex
10.1021/jacs.4c17713,"High-Energy, High-Power Sodium-Ion Batteries from a Layered Organic Cathode",2025,36,https://www.osti.gov/biblio/2555706,openalex
10.1002/cey2.288,Sulfur‐doped hard carbon hybrid anodes with dual lithium‐ion/metal storage bifunctionality for high‐energy‐density lithium‐ion batteries,2022,36,https://onlinelibrary.wiley.com/doi/pdfdirect/10.1002/cey2.288,openalex
10.1016/j.jpowsour.2016.11.022,Solid state synthesis of layered sodium manganese oxide for sodium-ion battery by in-situ high energy X-ray diffraction and X-ray absorption near edge spectroscopy,2016,35,https://www.sciencedirect.com/science/article/am/pii/S0378775316315488,openalex
10.1039/c9ta10113f,Local mobility in electrochemically inactive sodium in hard carbon anodes after the first cycle,2019,35,https://pubs.rsc.org/en/content/articlepdf/2020/ta/c9ta10113f,openalex
10.1039/d2ta03953b,A nitrogen- and carbonyl-rich conjugated small-molecule organic cathode for high-performance sodium-ion batteries,2022,35,https://www.osti.gov/biblio/1876949,openalex
10.1007/s40820-024-01560-9,Ideal Bi-Based Hybrid Anode Material for Ultrafast Charging of Sodium-Ion Batteries at Extremely Low Temperatures,2024,35,https://link.springer.com/content/pdf/10.1007/s40820-024-01560-9.pdf,openalex
10.1002/adfm.202421790,Simple Synthesis and Sodium Storage Analysis of Ultra‐High Nitrogen‐Doped Core‐Shell Mesoporous Carbon Nanospheres,2025,35,https://onlinelibrary.wiley.com/doi/pdfdirect/10.1002/adfm.202421790,openalex
10.1016/j.heliyon.2024.e29512,Recent progress on hard carbon and other anode materials for sodium-ion batteries,2024,35,https://doi.org/10.1016/j.heliyon.2024.e29512,openalex
10.1016/j.pmatsci.2024.101424,Progress in multi-electron sodium vanadium phosphate cathode for emerging sodium-ion batteries,2024,35,https://doi.org/10.1016/j.pmatsci.2024.101424,openalex
10.1039/d2mh01149b,Soft–hard interface design in super-elastic conductive polymer hydrogel containing Prussian blue analogues to enable highly efficient electrochemical deionization,2023,35,https://pubs.rsc.org/en/content/articlepdf/2023/mh/d2mh01149b,openalex
10.1039/d4ee06029f,An enhanced three-stage model for sodium storage in hard carbons,2025,35,https://pubs.rsc.org/en/content/articlepdf/2025/ee/d4ee06029f,openalex
10.1016/j.isci.2022.104205,Micron-sized single-crystal cathodes for sodium-ion batteries,2022,35,http://www.cell.com/article/S2589004222004758/pdf,openalex
10.1016/j.jallcom.2019.03.257,P2-type Na2/3Mn1/2Co1/3Cu1/6O2 as advanced cathode material for sodium-ion batteries: Electrochemical properties and electrode kinetics,2019,35,https://doi.org/10.1016/j.jallcom.2019.03.257,openalex
10.1016/j.eng.2022.04.011,The Sodium-Ion Battery: An Energy-Storage Technology for a Carbon-Neutral World,2022,35,https://doi.org/10.1016/j.eng.2022.04.011,openalex
10.1002/advs.202203552,Crystallinity Tuning of Na<sub>3</sub>V<sub>2</sub>(PO<sub>4</sub>)<sub>3</sub>: Unlocking Sodium Storage Capacity and Inducing Pseudocapacitance Behavior,2022,35,https://onlinelibrary.wiley.com/doi/pdfdirect/10.1002/advs.202203552,openalex
10.1039/d1ta08471b,Oxygen redox chemistry in P2-Na<sub>0.6</sub>Li<sub>0.11</sub>Fe<sub>0.27</sub>Mn<sub>0.62</sub>O<sub>2</sub> cathode for high-energy Na-ion batteries,2021,35,https://www.osti.gov/servlets/purl/1831453,openalex
10.31635/ccschem.024.202403938,Imidazole-Linked Fully Conjugated Covalent Organic Framework for High-Performance Sodium-Ion Battery,2024,35,https://doi.org/10.31635/ccschem.024.202403938,openalex
10.1088/2515-7655/ac2fb3,The role of NaSICON surface chemistry in stabilizing fast-charging Na metal solid-state batteries,2021,34,https://iopscience.iop.org/article/10.1088/2515-7655/ac2fb3/pdf,openalex
10.1021/acsomega.2c06261,Enhanced Electrochemical Performance of the Na<sub>3</sub>V<sub>2</sub>(PO<sub>4</sub>)<sub>3</sub>/C Cathode Material upon Doping with Mn/Fe for Na-Ion Batteries,2022,34,https://doi.org/10.1021/acsomega.2c06261,openalex
10.1021/acs.jpcc.8b07596,Insight on the Enhanced Reversibility of a Multimetal Layered Oxide for Sodium-Ion Battery,2018,34,http://hdl.handle.net/11392/2395699,openalex
10.1103/physrevmaterials.2.084201,Interpenetrating silicene networks: A topological nodal-line semimetal with potential as an anode material for sodium ion batteries,2018,34,https://www.osti.gov/biblio/1466854,openalex
10.1007/s12209-021-00311-w,Fluorine-Doped Hard Carbon as the Advanced Performance Anode Material of Sodium-Ion Batteries,2022,34,https://link.springer.com/content/pdf/10.1007/s12209-021-00311-w.pdf,openalex
10.1039/d1tc03709a,Regulating the metal nodes of 1D conjugated coordination polymers for enhancing the performance of sodium-ion batteries,2021,34,https://pubs.rsc.org/en/content/articlepdf/2022/tc/d1tc03709a,openalex
10.1039/c9nr04951g,Prussian blue analogue nanoenzymes mitigate oxidative stress and boost bio-fermentation,2019,34,https://pubs.rsc.org/en/content/articlepdf/2019/nr/c9nr04951g,openalex
10.1021/acsomega.2c00134,Computational Investigation of Two-Dimensional Vanadium Boride Compounds for Na-Ion Batteries,2022,34,https://pubs.acs.org/doi/pdf/10.1021/acsomega.2c00134,openalex
10.1002/open.202300178,Preparation of green high‐performance biomass‐derived hard carbon materials from bamboo powder waste,2024,34,https://onlinelibrary.wiley.com/doi/pdfdirect/10.1002/open.202300178,openalex
10.1002/batt.202000161,Hard Carbon Composite Electrodes for Sodium‐Ion Batteries with Nano‐Zeolite and Carbon Black Additives,2020,34,https://doi.org/10.1002/batt.202000161,openalex
10.1021/jacs.4c00869,Influence of Interlayer Cation Ordering on Na Transport in P2-Type Na<sub>0.67–<i>x</i></sub>Li<sub><i>y</i></sub> Ni<sub>0.33–<i>z</i></sub>Mn<sub>0.67+<i>z</i></sub>O<sub>2</sub> for Sodium-Ion Batteries,2024,34,https://pubs.acs.org/doi/pdf/10.1021/jacs.4c00869,openalex
10.1007/s40843-020-1318-4,Tuning anionic/cationic redox chemistry in a P2-type Na0.67Mn0.5Fe0.5O2 cathode material via a synergic strategy,2020,34,https://link.springer.com/content/pdf/10.1007/s40843-020-1318-4.pdf,openalex
10.1016/j.jallcom.2020.157533,Ultrathin MgO coating on fabricated O3–NaNi0.45Mn0.3Ti0.2Zr0.05O2 composite cathode via magnetron sputtering for enhanced kinetic and durable sodium-ion batteries,2020,34,https://www.osti.gov/biblio/2280113,openalex
10.1038/s41598-019-50154-8,Graphite carbon-encapsulated metal nanoparticles derived from Prussian blue analogs growing on natural loofa as cathode materials for rechargeable aluminum-ion batteries,2019,34,https://www.nature.com/articles/s41598-019-50154-8.pdf,openalex
10.1021/acsami.6b13869,Tunnel-Structured K<sub><i>x</i></sub>TiO<sub>2</sub> Nanorods by in Situ Carbothermal Reduction as a Long Cycle and High Rate Anode for Sodium-Ion Batteries,2017,34,https://www.osti.gov/biblio/1347366,openalex
10.1016/j.eng.2021.04.028,Modification of NASICON Electrolyte and Its Application in Real Na-Ion Cells,2021,34,https://doi.org/10.1016/j.eng.2021.04.028,openalex
10.1021/acsomega.1c02787,Lithium and Sodium Ion Binding Mechanisms and Diffusion Rates in Lignin-Based Hard Carbon Models,2021,34,https://pubs.acs.org/doi/pdf/10.1021/acsomega.1c02787,openalex
10.1149/2.0231708jes,Enhanced Cycle Performance of Quinone-Based Anodes for Sodium Ion Batteries by Attachment to Ordered Mesoporous Carbon and Use of Ionic Liquid Electrolyte,2017,34,https://doi.org/10.1149/2.0231708jes,openalex
10.3390/inorganics11070289,Recent Advances in Anode Materials for Sodium-Ion Batteries,2023,34,https://www.mdpi.com/2304-6740/11/7/289/pdf?version=1688633338,openalex
10.1002/celc.202201117,Electrochemical Characterization of Charge Storage at Anodes for Sodium‐Ion Batteries Based on Corncob Waste‐Derived Hard Carbon and Binder,2023,34,https://doi.org/10.1002/celc.202201117,openalex
10.1039/c8se00381e,"Beyond intercalation based sodium-ion batteries: the role of alloying anodes, efficient sodiation mechanisms and recent progress",2018,34,https://pubs.rsc.org/en/content/articlepdf/2018/se/c8se00381e,openalex
10.1007/s43979-023-00060-w,Solvation-enhanced electrolyte on layered oxide cathode tailoring even and stable CEI for durable sodium storage,2023,33,https://link.springer.com/content/pdf/10.1007/s43979-023-00060-w.pdf,openalex
10.1016/j.electacta.2019.135422,Electrochemistry of sodium titanate nanotubes as a negative electrode for sodium-ion batteries,2019,33,http://dx.doi.org/10.1016/j.electacta.2019.135422,openalex
10.1021/acsomega.9b04213,Anionic Redox Processes in Maricite- and Triphylite-NaFePO<sub>4</sub> of Sodium-Ion Batteries,2020,33,https://pubs.acs.org/doi/pdf/10.1021/acsomega.9b04213,openalex
10.1007/s40843-019-9474-0,Bimetallic phosphides embedded in hierarchical P-doped carbon for sodium ion battery and hydrogen evolution reaction applications,2019,33,https://link.springer.com/content/pdf/10.1007/s40843-019-9474-0.pdf,openalex
10.1002/advs.202417288,Electronic Modulation and Built‐in Electric Field Strategies in Heterostructures Together Induce 1T‐Rich MoS<sub>2</sub> Conversion for Advanced Sodium Storage,2025,33,https://onlinelibrary.wiley.com/doi/pdfdirect/10.1002/advs.202417288,openalex
10.1149/2.0881902jes,Water-Processable P2-Na<sub>0.67</sub>Ni<sub>0.22</sub>Cu<sub>0.11</sub>Mn<sub>0.56</sub>Ti<sub>0.11</sub>O<sub>2</sub>Cathode Material for Sodium Ion Batteries,2019,33,https://www.osti.gov/biblio/1501529,openalex
